{
  "id": "DEC-0013",
  "request_id": "REQ-0001",
  "task_id": "TASK-0004",
  "kind": "approve_stage",
  "question": "[DEC-0013] Duyệt kế hoạch ART-0004 (8 việc P1-P8)?",
  "context": "ART-0004 do planner nộp. P1-P4 executor viết nháp, P5 reviewer, P6-P7 người dùng tự áp dụng, P8 reviewer trên repo thật. ~47k token.",
  "options": [
    {"id": "A", "title": "Duyệt", "pros": ["Sang Thực thi"], "cons": [], "reversible": true},
    {"id": "B", "title": "Làm lại / sửa", "pros": [], "cons": ["Thêm token"], "reversible": true}
  ],
  "recommendation": {"option": "A", "reason": "Kế hoạch đủ, ánh xạ AC-1..AC-8."},
  "risk": "low", "risk_report": null, "status": "answered",
  "answer": {"action": "choose", "choice": "A", "note": "", "answered_at": "2026-10-30T18:40:00Z"}
}
